{
  "$schema": "https://json-schema.org/draft/2020-12/schema",
  "$id": "urn:dynamic-comic-video:production_brief:0.1",
  "title": "production_brief",
  "type": "object",
  "properties": {
    "version": {
      "const": "0.1"
    },
    "project_id": {
      "type": "string",
      "minLength": 1
    },
    "title": {
      "type": "string",
      "minLength": 1
    },
    "original_content": {
      "type": "string",
      "minLength": 1
    },
    "content_preservation": {
      "type": "array",
      "items": {
        "type": "string",
        "minLength": 1
      },
      "minItems": 1
    },
    "setting": {
      "type": "object",
      "properties": {
        "place": {
          "type": "string",
          "minLength": 1
        },
        "era": {
          "type": "string",
          "minLength": 1
        },
        "culture": {
          "type": "string",
          "minLength": 1
        }
      },
      "required": [
        "place",
        "era",
        "culture"
      ],
      "additionalProperties": false
    },
    "visual_language": {
      "type": "string",
      "minLength": 1
    },
    "style_preset": {
      "type": "string",
      "enum": ["paper-collage", "simple-comic", "custom"]
    },
    "render_profile": {
      "type": "string",
      "enum": ["comic-economy", "standard", "high-detail"]
    },
    "tone": {
      "type": "string",
      "minLength": 1
    },
    "content_strategy": {
      "type": "object",
      "properties": {
        "audience": {"type": "string", "minLength": 1},
        "platform": {"type": "string", "enum": ["douyin", "tiktok", "youtube-shorts", "bilibili", "general"]},
        "goal": {"type": "string", "enum": ["story", "education", "commentary", "promotion", "brand"]},
        "hook": {"type": "string", "minLength": 1},
        "core_promise": {"type": "string", "minLength": 1},
        "takeaway": {"type": "string", "minLength": 1},
        "cta": {"type": "string", "minLength": 1}
      },
      "required": ["audience", "platform", "goal", "hook", "core_promise", "takeaway"],
      "additionalProperties": false
    },
    "outro_card": {
      "type": "object",
      "properties": {
        "enabled": {"type": "boolean"},
        "kind": {"enum": ["knowledge", "summary", "cta", "none"]},
        "rationale": {"type": "string", "minLength": 1},
        "shot_id": {"type": "string", "minLength": 1},
        "duration_frames": {"type": "integer", "minimum": 2}
      },
      "required": ["enabled"],
      "additionalProperties": false
    },
    "format": {
      "type": "object",
      "properties": {
        "width": {
          "type": "integer",
          "minimum": 1
        },
        "height": {
          "type": "integer",
          "minimum": 1
        },
        "fps": {
          "enum": [
            24,
            25,
            30,
            60
          ]
        },
        "duration_frames": {
          "type": "integer",
          "minimum": 1
        }
      },
      "required": [
        "width",
        "height",
        "fps",
        "duration_frames"
      ],
      "additionalProperties": false
    },
    "assumptions": {
      "type": "array",
      "items": {
        "type": "string",
        "minLength": 1
      },
      "minItems": 0
    }
  },
  "required": [
    "version",
    "project_id",
    "title",
    "original_content",
    "content_preservation",
    "setting",
    "visual_language",
    "tone",
    "format",
    "assumptions"
  ],
  "additionalProperties": false
}
